{
  "$schema": "https://json-schema.org/draft/2020-12/schema",
  "type": "object",
  "properties": {
    "id": {
      "type": "string",
      "minLength": 1
    },
    "type": {
      "type": "string",
      "enum": [
        "historical_download",
        "tick_record",
        "archive",
        "instrument_sync"
      ]
    },
    "status": {
      "type": "string",
      "enum": [
        "draft",
        "queued",
        "running",
        "completed",
        "failed",
        "cancelled",
        "paused"
      ]
    },
    "exchange": {
      "type": "string",
      "enum": [
        "NSE",
        "NFO"
      ]
    },
    "segment": {
      "type": "string",
      "enum": [
        "equity_delivery",
        "equity_intraday",
        "futures",
        "options"
      ]
    },
    "symbols": {
      "type": "array",
      "items": {
        "type": "string",
        "minLength": 1
      }
    },
    "timeframe": {
      "anyOf": [
        {
          "type": "string",
          "enum": [
            "1m",
            "3m",
            "5m",
            "15m",
            "30m",
            "1h",
            "1d"
          ]
        },
        {
          "type": "null"
        }
      ]
    },
    "from": {
      "anyOf": [
        {
          "type": "string",
          "format": "date",
          "pattern": "^(?:(?:\\d\\d[2468][048]|\\d\\d[13579][26]|\\d\\d0[48]|[02468][048]00|[13579][26]00)-02-29|\\d{4}-(?:(?:0[13578]|1[02])-(?:0[1-9]|[12]\\d|3[01])|(?:0[469]|11)-(?:0[1-9]|[12]\\d|30)|(?:02)-(?:0[1-9]|1\\d|2[0-8])))$"
        },
        {
          "type": "null"
        }
      ]
    },
    "to": {
      "anyOf": [
        {
          "type": "string",
          "format": "date",
          "pattern": "^(?:(?:\\d\\d[2468][048]|\\d\\d[13579][26]|\\d\\d0[48]|[02468][048]00|[13579][26]00)-02-29|\\d{4}-(?:(?:0[13578]|1[02])-(?:0[1-9]|[12]\\d|3[01])|(?:0[469]|11)-(?:0[1-9]|[12]\\d|30)|(?:02)-(?:0[1-9]|1\\d|2[0-8])))$"
        },
        {
          "type": "null"
        }
      ]
    },
    "progressPercent": {
      "type": "number",
      "minimum": 0,
      "maximum": 100
    },
    "rowsWritten": {
      "type": "integer",
      "minimum": 0,
      "maximum": 9007199254740991
    },
    "createdAt": {
      "type": "string",
      "format": "date-time",
      "pattern": "^(?:(?:\\d\\d[2468][048]|\\d\\d[13579][26]|\\d\\d0[48]|[02468][048]00|[13579][26]00)-02-29|\\d{4}-(?:(?:0[13578]|1[02])-(?:0[1-9]|[12]\\d|3[01])|(?:0[469]|11)-(?:0[1-9]|[12]\\d|30)|(?:02)-(?:0[1-9]|1\\d|2[0-8])))T(?:(?:[01]\\d|2[0-3]):[0-5]\\d:[0-5]\\d(?:\\.\\d+)?(?:Z))$"
    },
    "startedAt": {
      "anyOf": [
        {
          "type": "string",
          "format": "date-time",
          "pattern": "^(?:(?:\\d\\d[2468][048]|\\d\\d[13579][26]|\\d\\d0[48]|[02468][048]00|[13579][26]00)-02-29|\\d{4}-(?:(?:0[13578]|1[02])-(?:0[1-9]|[12]\\d|3[01])|(?:0[469]|11)-(?:0[1-9]|[12]\\d|30)|(?:02)-(?:0[1-9]|1\\d|2[0-8])))T(?:(?:[01]\\d|2[0-3]):[0-5]\\d:[0-5]\\d(?:\\.\\d+)?(?:Z))$"
        },
        {
          "type": "null"
        }
      ]
    },
    "finishedAt": {
      "anyOf": [
        {
          "type": "string",
          "format": "date-time",
          "pattern": "^(?:(?:\\d\\d[2468][048]|\\d\\d[13579][26]|\\d\\d0[48]|[02468][048]00|[13579][26]00)-02-29|\\d{4}-(?:(?:0[13578]|1[02])-(?:0[1-9]|[12]\\d|3[01])|(?:0[469]|11)-(?:0[1-9]|[12]\\d|30)|(?:02)-(?:0[1-9]|1\\d|2[0-8])))T(?:(?:[01]\\d|2[0-3]):[0-5]\\d:[0-5]\\d(?:\\.\\d+)?(?:Z))$"
        },
        {
          "type": "null"
        }
      ]
    },
    "error": {
      "type": [
        "string",
        "null"
      ]
    },
    "summary": {
      "anyOf": [
        {
          "type": "string",
          "maxLength": 500
        },
        {
          "type": "null"
        }
      ]
    },
    "syncResult": {
      "anyOf": [
        {
          "type": "object",
          "properties": {
            "newSymbols": {
              "type": "array",
              "items": {
                "type": "string",
                "minLength": 1
              }
            },
            "newIndexMembers": {
              "type": "array",
              "items": {
                "type": "object",
                "properties": {
                  "symbol": {
                    "type": "string",
                    "minLength": 1
                  },
                  "index": {
                    "type": "string",
                    "minLength": 1
                  }
                },
                "required": [
                  "symbol",
                  "index"
                ],
                "additionalProperties": false
              }
            }
          },
          "required": [
            "newSymbols",
            "newIndexMembers"
          ],
          "additionalProperties": false
        },
        {
          "type": "null"
        }
      ]
    },
    "mode": {
      "anyOf": [
        {
          "type": "string",
          "enum": [
            "skip_existing",
            "overwrite"
          ]
        },
        {
          "type": "null"
        }
      ]
    },
    "plan": {
      "anyOf": [
        {
          "type": "object",
          "properties": {
            "steps": {
              "type": "integer",
              "minimum": 0,
              "maximum": 9007199254740991
            },
            "skippedSteps": {
              "type": "integer",
              "minimum": 0,
              "maximum": 9007199254740991
            },
            "requests": {
              "type": "integer",
              "minimum": 0,
              "maximum": 9007199254740991
            },
            "estimatedRows": {
              "type": "integer",
              "minimum": 0,
              "maximum": 9007199254740991
            },
            "estimatedBytes": {
              "type": "integer",
              "minimum": 0,
              "maximum": 9007199254740991
            },
            "estimatedSeconds": {
              "type": "integer",
              "minimum": 0,
              "maximum": 9007199254740991
            },
            "estimatedStartAt": {
              "type": "string",
              "format": "date-time",
              "pattern": "^(?:(?:\\d\\d[2468][048]|\\d\\d[13579][26]|\\d\\d0[48]|[02468][048]00|[13579][26]00)-02-29|\\d{4}-(?:(?:0[13578]|1[02])-(?:0[1-9]|[12]\\d|3[01])|(?:0[469]|11)-(?:0[1-9]|[12]\\d|30)|(?:02)-(?:0[1-9]|1\\d|2[0-8])))T(?:(?:[01]\\d|2[0-3]):[0-5]\\d:[0-5]\\d(?:\\.\\d+)?(?:Z))$"
            },
            "jobsAhead": {
              "type": "integer",
              "minimum": 0,
              "maximum": 9007199254740991
            },
            "perSymbol": {
              "type": "array",
              "items": {
                "type": "object",
                "properties": {
                  "symbol": {
                    "type": "string",
                    "minLength": 1
                  },
                  "steps": {
                    "type": "integer",
                    "minimum": 0,
                    "maximum": 9007199254740991
                  },
                  "skippedSteps": {
                    "type": "integer",
                    "minimum": 0,
                    "maximum": 9007199254740991
                  },
                  "existingFrom": {
                    "anyOf": [
                      {
                        "type": "string",
                        "format": "date",
                        "pattern": "^(?:(?:\\d\\d[2468][048]|\\d\\d[13579][26]|\\d\\d0[48]|[02468][048]00|[13579][26]00)-02-29|\\d{4}-(?:(?:0[13578]|1[02])-(?:0[1-9]|[12]\\d|3[01])|(?:0[469]|11)-(?:0[1-9]|[12]\\d|30)|(?:02)-(?:0[1-9]|1\\d|2[0-8])))$"
                      },
                      {
                        "type": "null"
                      }
                    ]
                  },
                  "existingTo": {
                    "anyOf": [
                      {
                        "type": "string",
                        "format": "date",
                        "pattern": "^(?:(?:\\d\\d[2468][048]|\\d\\d[13579][26]|\\d\\d0[48]|[02468][048]00|[13579][26]00)-02-29|\\d{4}-(?:(?:0[13578]|1[02])-(?:0[1-9]|[12]\\d|3[01])|(?:0[469]|11)-(?:0[1-9]|[12]\\d|30)|(?:02)-(?:0[1-9]|1\\d|2[0-8])))$"
                      },
                      {
                        "type": "null"
                      }
                    ]
                  }
                },
                "required": [
                  "symbol",
                  "steps",
                  "skippedSteps",
                  "existingFrom",
                  "existingTo"
                ],
                "additionalProperties": false
              }
            },
            "warnings": {
              "type": "array",
              "items": {
                "type": "string",
                "minLength": 1
              }
            }
          },
          "required": [
            "steps",
            "skippedSteps",
            "requests",
            "estimatedRows",
            "estimatedBytes",
            "estimatedSeconds",
            "estimatedStartAt",
            "jobsAhead",
            "perSymbol",
            "warnings"
          ],
          "additionalProperties": false
        },
        {
          "type": "null"
        }
      ]
    },
    "stepsDone": {
      "type": "integer",
      "minimum": 0,
      "maximum": 9007199254740991
    },
    "stepsTotal": {
      "type": "integer",
      "minimum": 0,
      "maximum": 9007199254740991
    },
    "expiresAt": {
      "anyOf": [
        {
          "type": "string",
          "format": "date-time",
          "pattern": "^(?:(?:\\d\\d[2468][048]|\\d\\d[13579][26]|\\d\\d0[48]|[02468][048]00|[13579][26]00)-02-29|\\d{4}-(?:(?:0[13578]|1[02])-(?:0[1-9]|[12]\\d|3[01])|(?:0[469]|11)-(?:0[1-9]|[12]\\d|30)|(?:02)-(?:0[1-9]|1\\d|2[0-8])))T(?:(?:[01]\\d|2[0-3]):[0-5]\\d:[0-5]\\d(?:\\.\\d+)?(?:Z))$"
        },
        {
          "type": "null"
        }
      ]
    }
  },
  "required": [
    "id",
    "type",
    "status",
    "exchange",
    "segment",
    "symbols",
    "timeframe",
    "from",
    "to",
    "progressPercent",
    "rowsWritten",
    "createdAt",
    "startedAt",
    "finishedAt",
    "error",
    "summary",
    "mode",
    "plan",
    "stepsDone",
    "stepsTotal",
    "expiresAt"
  ],
  "additionalProperties": false
}
