[
  {
    "id": "job_001",
    "type": "historical_download",
    "status": "completed",
    "exchange": "NSE",
    "segment": "equity_intraday",
    "symbols": ["RELIANCE", "TCS", "INFY"],
    "timeframe": "5m",
    "from": "2026-01-01",
    "to": "2026-06-30",
    "progressPercent": 100,
    "rowsWritten": 125000,
    "createdAt": "2026-07-01T04:00:00Z",
    "startedAt": "2026-07-01T04:00:05Z",
    "finishedAt": "2026-07-01T04:25:30Z",
    "error": null,
    "summary": null,
    "mode": "skip_existing",
    "plan": null,
    "stepsDone": 0,
    "stepsTotal": 0,
    "expiresAt": null,
    "syncResult": null
  },
  {
    "id": "job_002",
    "type": "tick_record",
    "status": "running",
    "exchange": "NSE",
    "segment": "equity_intraday",
    "symbols": ["NIFTY 50", "NIFTY BANK"],
    "timeframe": null,
    "from": null,
    "to": null,
    "progressPercent": 45,
    "rowsWritten": 54000,
    "createdAt": "2026-09-21T03:45:00Z",
    "startedAt": "2026-09-21T03:45:02Z",
    "finishedAt": null,
    "error": null,
    "summary": null,
    "mode": null,
    "plan": null,
    "stepsDone": 0,
    "stepsTotal": 0,
    "expiresAt": null,
    "syncResult": null
  },
  {
    "id": "job_003",
    "type": "archive",
    "status": "queued",
    "exchange": "NSE",
    "segment": "equity_delivery",
    "symbols": ["HDFCBANK", "ICICIBANK"],
    "timeframe": null,
    "from": null,
    "to": null,
    "progressPercent": 0,
    "rowsWritten": 0,
    "createdAt": "2026-09-21T06:10:00Z",
    "startedAt": null,
    "finishedAt": null,
    "error": null,
    "summary": null,
    "mode": null,
    "plan": null,
    "stepsDone": 0,
    "stepsTotal": 0,
    "expiresAt": null,
    "syncResult": null
  },
  {
    "id": "job_004",
    "type": "historical_download",
    "status": "failed",
    "exchange": "NSE",
    "segment": "equity_delivery",
    "symbols": ["SBIN"],
    "timeframe": "1d",
    "from": "2025-01-01",
    "to": "2025-12-31",
    "progressPercent": 30,
    "rowsWritten": 75,
    "createdAt": "2026-08-10T05:00:00Z",
    "startedAt": "2026-08-10T05:00:02Z",
    "finishedAt": "2026-08-10T05:01:15Z",
    "error": "Rate limit exceeded on historical data API",
    "summary": null,
    "mode": "skip_existing",
    "plan": null,
    "stepsDone": 0,
    "stepsTotal": 0,
    "expiresAt": null,
    "syncResult": null
  },
  {
    "id": "job_005",
    "type": "archive",
    "status": "cancelled",
    "exchange": "NSE",
    "segment": "equity_delivery",
    "symbols": ["TATAMOTORS"],
    "timeframe": null,
    "from": null,
    "to": null,
    "progressPercent": 15,
    "rowsWritten": 1200,
    "createdAt": "2026-09-15T02:00:00Z",
    "startedAt": "2026-09-15T02:00:05Z",
    "finishedAt": "2026-09-15T02:05:00Z",
    "error": null,
    "summary": null,
    "mode": null,
    "plan": null,
    "stepsDone": 0,
    "stepsTotal": 0,
    "expiresAt": null,
    "syncResult": null
  },
  {
    "id": "job_006",
    "type": "instrument_sync",
    "status": "completed",
    "exchange": "NSE",
    "segment": "equity_delivery",
    "symbols": [],
    "timeframe": null,
    "from": null,
    "to": null,
    "progressPercent": 100,
    "rowsWritten": 26,
    "createdAt": "2026-09-15T03:15:00Z",
    "startedAt": "2026-09-15T03:15:02Z",
    "finishedAt": "2026-09-15T03:15:40Z",
    "error": null,
    "summary": "26 stocks synced; 2 new listing(s): GREENGRID-SM, NOVATECH",
    "mode": null,
    "plan": null,
    "stepsDone": 0,
    "stepsTotal": 0,
    "expiresAt": null,
    "syncResult": { "newSymbols": ["GREENGRID-SM", "NOVATECH"], "newIndexMembers": [] }
  }
]
